{
  "$schema": "http://json-schema.org/draft-07/schema#",
  "$id": "https://resistancezero.com/data/dcai-parameters.schema.json",
  "title": "AI / HPC (GB300) cockpit parameter registry",
  "description": "One record per quantity published by js/dcai-engine.js. GENERATED fields (value, kind, dependsOnInputs, dependsOnInputsAtCliff, consumers, tests, docs, source for authored leaves) are derived by tools/build-dcai-parameter-registry.mjs from the engine, the model's own `// source:` comments, and the pages that read it. CURATED fields (label, unit, scope, formula, formulaExpr, display) come from data/dcai-parameters.curated.json. Regenerating must produce a byte-identical file — a drift is a ship-gate failure.",
  "type": "object",
  "required": ["generatedBy", "engineVersion", "parameters"],
  "additionalProperties": false,
  "properties": {
    "generatedBy": { "type": "string" },
    "engineVersion": { "type": "string" },
    "note": { "type": "string" },
    "parameters": {
      "type": "array",
      "minItems": 1,
      "items": { "$ref": "#/definitions/parameter" }
    }
  },
  "definitions": {
    "parameter": {
      "type": "object",
      "required": ["id", "kind", "value", "dependsOnInputs", "consumers", "tests", "docs"],
      "additionalProperties": false,
      "properties": {
        "id": {
          "description": "Dotted path on DCAI_CALC.snapshot, e.g. design.planes.p04_free_cooling_margin_k. Primary key.",
          "type": "string",
          "pattern": "^[a-z][a-z0-9_]*(\\.[a-z][a-z0-9_]*)+$"
        },
        "label": { "type": "string" },
        "unit": { "type": ["string", "null"] },
        "kind": {
          "description": "authored = republishes one model leaf unchanged; derived = an input moves it at the design point; slack = NO input moves it at the design point but one does past the free-cooling cliff — a parameter sitting on the losing side of a min/max or a regime switch. Without this third kind the CDU approach and the liquid-path COP would be misfiled as dead inputs.",
          "enum": ["authored", "derived", "slack"]
        },
        "value": { "type": ["number", "string", "boolean", "null"] },
        "formula": { "type": ["string", "null"] },
        "deps": { "type": "array", "items": { "type": "string" } },
        "scope": {
          "description": "Physical extent the number describes. A campus numerator over a hall denominator is the defect this field makes visible.",
          "enum": ["campus", "hall", "rack", "plant", "site", "network", "meta"]
        },
        "evidenceClass": {
          "enum": ["MEASURED", "DERIVED", "SIMULATED", "ADOPTED", "ASSUMED", "VENDOR", "PUBLISHED", "STANDARD", "LABEL", "UNAVAILABLE"]
        },
        "source": {
          "type": "object",
          "additionalProperties": false,
          "properties": {
            "ref": { "type": "string" },
            "section": { "type": "string" },
            "asOf": { "type": "string", "pattern": "^\\d{4}-\\d{2}-\\d{2}$" },
            "method": { "type": "string" }
          }
        },
        "explainKey": { "type": ["string", "null"] },
        "consumers": {
          "description": "Pages that read this path. GENERATED by source grep.",
          "type": "array",
          "items": {
            "type": "object",
            "required": ["page", "reads"],
            "additionalProperties": false,
            "properties": { "page": { "type": "string" }, "reads": { "type": "integer", "minimum": 1 } }
          }
        },
        "tests": { "type": "array", "items": { "type": "string" } },
        "docs": { "type": "array", "items": { "type": "string" } },
        "dependsOnInputs": {
          "description": "DCAI_MODEL leaves that MEASURABLY move this parameter at the DESIGN point, from recomputing the engine once per leaf in each direction (x1.37 and x0.73). GENERATED.",
          "type": "array",
          "items": { "type": "string" }
        },
        "dependsOnInputsAtCliff": {
          "description": "The same measurement taken half a kelvin PAST the free-cooling cliff. A parameter with edges here and none at design is `slack`. GENERATED.",
          "type": "array",
          "items": { "type": "string" }
        },
        "formulaExpr": { "type": "string" },
        "formulaNotExpressible": { "type": "string" },
        "display": { "enum": ["internal"] },
        "displayReason": { "type": "string", "minLength": 40 }
      }
    }
  }
}
