{
  "generatedBy": "tools/build-conv-parameter-registry.mjs",
  "engineVersion": "2.2.0",
  "note": "GENERATED — do not hand-edit. Curated metadata lives in data/conv-parameters.curated.json.",
  "parameters": [
    {
      "id": "campus.hall_count",
      "label": "Halls in the campus",
      "unit": null,
      "kind": "authored",
      "value": 4,
      "formula": "halls.length",
      "deps": [],
      "scope": "campus",
      "evidenceClass": "ADOPTED",
      "explainKey": null,
      "dependsOnInputs": [],
      "consumers": [
        {
          "page": "dc-conventional.html",
          "reads": 7
        },
        {
          "page": "fire-system.html",
          "reads": 2
        }
      ],
      "tests": [
        "test-conv-parameter-registry.mjs (provenance + evidence class)",
        "test-conv-basis-drawer.mjs (drawer value vs dc-conventional.html)"
      ],
      "docs": [
        "manual/dc-conventional.html",
        "manual/fire-system.html"
      ],
      "source": {
        "ref": "js/conv-design-basis.js STUDY_INPUT (conv-four-hall-air-study-2026-08-27)",
        "section": "halls",
        "asOf": "2026-08-28",
        "method": "Structural: the number of halls is the length of the authored hall list, so no numeric input can move it."
      }
    },
    {
      "id": "campus.halls",
      "label": "Per-hall snapshots",
      "unit": null,
      "kind": "derived",
      "value": "[4 items] sha1:041e61fce75f",
      "formula": "projection of the authored per-hall inputs",
      "formulaNotExpressible": "A structural projection of the per-hall inputs, not an arithmetic expression over registered scalars.",
      "deps": [],
      "scope": "campus",
      "evidenceClass": "DERIVED",
      "explainKey": null,
      "dependsOnInputs": [
        "campus.halls.0.it_design_kw",
        "campus.halls.0.it_load_kw",
        "campus.halls.0.rack_design_avg_kw",
        "campus.halls.0.rack_selected_peak_kw",
        "campus.halls.0.racks",
        "campus.halls.1.it_design_kw",
        "campus.halls.1.it_load_kw",
        "campus.halls.1.rack_design_avg_kw",
        "campus.halls.1.rack_selected_peak_kw",
        "campus.halls.1.racks",
        "campus.halls.2.it_design_kw",
        "campus.halls.2.it_load_kw",
        "campus.halls.2.rack_design_avg_kw",
        "campus.halls.2.rack_selected_peak_kw",
        "campus.halls.2.racks",
        "campus.halls.3.it_design_kw",
        "campus.halls.3.it_load_kw",
        "campus.halls.3.rack_design_avg_kw",
        "campus.halls.3.rack_selected_peak_kw",
        "campus.halls.3.racks",
        "site.pue"
      ],
      "consumers": [
        {
          "page": "dc-conventional.html",
          "reads": 11
        },
        {
          "page": "ict.html",
          "reads": 2
        },
        {
          "page": "EPMS_Telemetry.html",
          "reads": 2
        }
      ],
      "tests": [
        "test-conv-design-basis.mjs",
        "test-conv-snapshot-binding.mjs",
        "test-datahall-ai-rack-density.mjs"
      ],
      "docs": [
        "manual/datahall.html"
      ],
      "source": {
        "ref": "js/conv-engine.js",
        "asOf": "2026-08-28",
        "section": "buildHalls()",
        "method": "Projection of the per-hall inputs; no hall authors its own capacity."
      }
    },
    {
      "id": "campus.it_design_kw",
      "label": "Campus IT design capacity",
      "unit": "kW",
      "kind": "derived",
      "value": 40000,
      "formula": "hall_count x it_design_kw_per_hall",
      "formulaExpr": "campus.hall_count * hall.it_design_kw",
      "deps": [
        "campus.hall_count",
        "hall.it_design_kw"
      ],
      "scope": "campus",
      "evidenceClass": "DERIVED",
      "explainKey": null,
      "dependsOnInputs": [
        "campus.halls.0.it_design_kw",
        "campus.halls.1.it_design_kw",
        "campus.halls.2.it_design_kw",
        "campus.halls.3.it_design_kw"
      ],
      "consumers": [
        {
          "page": "dc-conventional.html",
          "reads": 2
        }
      ],
      "tests": [
        "test-conv-formula.mjs (formula evaluated)",
        "test-conv-basis-drawer.mjs (drawer value vs dc-conventional.html)"
      ],
      "docs": [],
      "source": {
        "ref": "js/conv-engine.js",
        "asOf": "2026-08-28",
        "method": "4 x 10,000 kW."
      }
    },
    {
      "id": "campus.it_load_kw",
      "label": "Campus IT load",
      "unit": "kW",
      "kind": "derived",
      "value": 30000,
      "formula": "hall_count x active scenario it_kw_per_hall",
      "formulaExpr": "campus.hall_count * hall.it_load_kw",
      "deps": [
        "campus.hall_count",
        "hall.it_load_kw"
      ],
      "scope": "campus",
      "evidenceClass": "DERIVED",
      "explainKey": null,
      "dependsOnInputs": [
        "campus.halls.0.it_load_kw",
        "campus.halls.1.it_load_kw",
        "campus.halls.2.it_load_kw",
        "campus.halls.3.it_load_kw"
      ],
      "consumers": [
        {
          "page": "dc-conventional.html",
          "reads": 3
        }
      ],
      "tests": [
        "test-conv-formula.mjs (formula evaluated)"
      ],
      "docs": [],
      "source": {
        "ref": "js/conv-engine.js",
        "asOf": "2026-08-28",
        "method": "4 x 7,500 kW at the adopted normal scenario."
      }
    },
    {
      "id": "campus.rack_design_avg_kw",
      "label": "Cabinet design average",
      "unit": "kW/rack",
      "kind": "authored",
      "value": 20,
      "formula": null,
      "deps": [],
      "scope": "campus",
      "evidenceClass": "ADOPTED",
      "explainKey": null,
      "dependsOnInputs": [
        "campus.rack_design_avg_kw"
      ],
      "consumers": [
        {
          "page": "dc-conventional.html",
          "reads": 2
        }
      ],
      "tests": [
        "test-conv-parameter-registry.mjs (provenance + evidence class)",
        "test-conv-basis-drawer.mjs (drawer value vs dc-conventional.html)"
      ],
      "docs": [],
      "source": {
        "ref": "js/conv-design-basis.js STUDY_INPUT (conv-four-hall-air-study-2026-08-27)",
        "asOf": "2026-08-28",
        "section": "rack.selectedAverageKw"
      }
    },
    {
      "id": "campus.rack_selected_peak_kw",
      "label": "Cabinet selected peak",
      "unit": "kW/rack",
      "kind": "authored",
      "value": 30,
      "formula": null,
      "deps": [],
      "scope": "campus",
      "evidenceClass": "ADOPTED",
      "explainKey": null,
      "dependsOnInputs": [
        "campus.rack_selected_peak_kw"
      ],
      "consumers": [
        {
          "page": "dc-conventional.html",
          "reads": 1
        }
      ],
      "tests": [
        "test-conv-parameter-registry.mjs (provenance + evidence class)"
      ],
      "docs": [],
      "source": {
        "ref": "js/conv-design-basis.js STUDY_INPUT (conv-four-hall-air-study-2026-08-27)",
        "asOf": "2026-08-28",
        "section": "rack.selectedPeakKw"
      }
    },
    {
      "id": "campus.racks_total",
      "label": "Campus cabinet count",
      "unit": null,
      "kind": "derived",
      "value": 2000,
      "formula": "hall_count x racks_per_hall",
      "formulaExpr": "campus.hall_count * hall.racks",
      "deps": [
        "campus.hall_count",
        "hall.racks"
      ],
      "scope": "campus",
      "evidenceClass": "DERIVED",
      "explainKey": null,
      "dependsOnInputs": [
        "campus.halls.0.racks",
        "campus.halls.1.racks",
        "campus.halls.2.racks",
        "campus.halls.3.racks"
      ],
      "consumers": [
        {
          "page": "dc-conventional.html",
          "reads": 24
        },
        {
          "page": "datahall.html",
          "reads": 2
        },
        {
          "page": "fire-system.html",
          "reads": 4
        },
        {
          "page": "EPMS_Telemetry.html",
          "reads": 4
        }
      ],
      "tests": [
        "test-conv-document-parity.mjs",
        "test-conv-snapshot-binding.mjs",
        "test-conv-formula.mjs (formula evaluated)",
        "test-conv-basis-drawer.mjs (drawer value vs dc-conventional.html)"
      ],
      "docs": [
        "manual/dc-conventional.html",
        "manual/epms-telemetry.html",
        "manual/fire-system.html",
        "manual/ict.html"
      ],
      "source": {
        "ref": "js/conv-engine.js",
        "asOf": "2026-08-28",
        "method": "4 x 500 cabinets."
      }
    },
    {
      "id": "campus.scenario_evidence_class",
      "label": "Active scenario evidence class",
      "unit": null,
      "kind": "authored",
      "value": "SIMULATED/ADOPTED",
      "formula": null,
      "formulaNotExpressible": "A text label carried from the active scenario row.",
      "display": "internal",
      "displayReason": "Rendered as part of the scenario line on the dc-conventional design-basis panel rather than as a separate figure.",
      "deps": [
        "campus.scenario_id"
      ],
      "scope": "meta",
      "evidenceClass": "DERIVED",
      "explainKey": null,
      "dependsOnInputs": [],
      "consumers": [
        {
          "page": "dc-conventional.html",
          "reads": 3
        }
      ],
      "tests": [
        "test-conv-parameter-registry.mjs (semantic check)"
      ],
      "docs": [],
      "source": {
        "ref": "js/conv-engine.js",
        "asOf": "2026-08-28"
      }
    },
    {
      "id": "campus.scenario_id",
      "label": "Active scenario id",
      "unit": null,
      "kind": "authored",
      "value": "normal",
      "formula": null,
      "deps": [],
      "scope": "meta",
      "evidenceClass": "ADOPTED",
      "explainKey": null,
      "dependsOnInputs": [],
      "consumers": [
        {
          "page": "dc-conventional.html",
          "reads": 2
        }
      ],
      "tests": [
        "test-conv-parameter-registry.mjs",
        "test-conv-parameter-registry.mjs (semantic check)",